{
  "a_axis": 4.947305346848307,
  "atomic_radius_mean": 1.5166666666666666,
  "b_axis": 4.947304466549198,
  "bond_length_mean": 2.7582939411322975,
  "bond_length_range": 0.4296577089131737,
  "bond_length_std": 0.20127707361512398,
  "bond_max_en_diff": 0.6399999999999999,
  "bond_mean_en_diff": 0.23000000000000004,
  "bond_std_en_diff": 0.29063149634316415,
  "c_axis_cached": 4.947304128800708,
  "c_over_a": 0.9999997537957508,
  "c_over_b": 0.9999999317308056,
  "cart_z_span_over_c": 1.2497540457946281,
  "chemical_system": "Lu-Ni-Sn",
  "composition_family": "metallic_or_intermetallic",
  "coord_max": 12.0,
  "coord_mean": 12.0,
  "coord_min": 12.0,
  "coord_std": 0.0,
  "crystal_system_code": 7,
  "dataset_kind": "external_structure",
  "electronegativity_range": 0.69,
  "element_set": [
    "Lu",
    "Ni",
    "Sn"
  ],
  "energy_above_hull": null,
  "external_id": "EXT-JVASP-30-TEST",
  "external_source_file": "<ORIGINAL_RUN_ROOT>/POSCAR_JVASP-86726",
  "external_source_format": "poscar",
  "formation_energy": null,
  "formation_energy_peratom": null,
  "formula": "LuNi4Sn",
  "frac_high_coord_sites": 1.0,
  "frac_low_coord_sites": 0.0,
  "frac_short_bonds": 0.0,
  "frac_z_span": 0.6248769596428019,
  "ionicity_proxy_comp": 0.69,
  "is_centrosymmetric": 0,
  "jid": "EXT-JVASP-30-TEST",
  "known_synthesized": null,
  "material_type": "external",
  "max_axis_over_min_axis": 1.0000002462043098,
  "mean_electronegativity": 1.7133333333333332,
  "metal_count": 3,
  "n_elements": 3,
  "n_symmetry_ops": 24,
  "nonmetal_count": 0,
  "reduced_formula": "LuNi4Sn",
  "spacegroup_number": 216,
  "valence_electrons_mean": 9.0,
  "volume_per_atom": 14.270516396376394
}
