{
  "a_axis": 10.149728374811527,
  "atomic_radius_mean": 1.5,
  "b_axis": 10.149728122226048,
  "bond_length_mean": 2.603211512611918,
  "bond_length_range": 1.0578205935920486,
  "bond_length_std": 0.3843209757466109,
  "bond_max_en_diff": 2.55,
  "bond_mean_en_diff": 1.518913043478261,
  "bond_std_en_diff": 1.1345813789596766,
  "c_axis_cached": 10.149728034785705,
  "c_over_a": 0.9999999664990225,
  "c_over_b": 0.9999999913849571,
  "cart_z_span_over_c": 2.3197666439888383,
  "chemical_system": "Ba-Ce-Mn-O",
  "composition_family": "mixed_metal_nonmetal",
  "coord_max": 12.0,
  "coord_mean": 9.2,
  "coord_min": 6.0,
  "coord_std": 1.96468827043885,
  "crystal_system_code": 5,
  "dataset_kind": "external_structure",
  "electronegativity_range": 2.55,
  "element_set": [
    "Ba",
    "Ce",
    "Mn",
    "O"
  ],
  "energy_above_hull": null,
  "external_id": "EXT-JVASP-30-TEST",
  "external_source_file": "<ORIGINAL_RUN_ROOT>/POSCAR_JVASP-98550",
  "external_source_format": "poscar",
  "formation_energy": null,
  "formation_energy_peratom": null,
  "formula": "Ba4CeMn3O12",
  "frac_high_coord_sites": 0.85,
  "frac_low_coord_sites": 0.0,
  "frac_short_bonds": 0.1956521739130435,
  "frac_z_span": 0.8689191303109276,
  "ionicity_proxy_comp": 2.55,
  "is_centrosymmetric": 1,
  "jid": "EXT-JVASP-30-TEST",
  "known_synthesized": null,
  "material_type": "external",
  "max_axis_over_min_axis": 1.0000000335009787,
  "mean_electronegativity": 1.75,
  "metal_count": 3,
  "n_elements": 4,
  "n_symmetry_ops": 12,
  "nonmetal_count": 1,
  "reduced_formula": "Ba4CeMn3O12",
  "spacegroup_number": 166,
  "valence_electrons_mean": 7.0,
  "volume_per_atom": 14.152408383735722
}
