{
  "a_axis": 3.2250494729190726,
  "atomic_radius_mean": 1.2374999999999998,
  "b_axis": 3.225048634908733,
  "bond_length_mean": 2.456354961592108,
  "bond_length_range": 0.11010550940489905,
  "bond_length_std": 0.04587667985768789,
  "bond_max_en_diff": 0.41999999999999993,
  "bond_mean_en_diff": 0.26250000000000007,
  "bond_std_en_diff": 0.09175374651751278,
  "c_axis_cached": 34.14068378858427,
  "c_over_a": 10.586096143722932,
  "c_over_b": 10.586098894459132,
  "cart_z_span_over_c": 0.6527581512778059,
  "chemical_system": "Mo-S-Se-W",
  "composition_family": "mixed_metal_nonmetal",
  "coord_max": 6.0,
  "coord_mean": 4.0,
  "coord_min": 3.0,
  "coord_std": 1.4142135623730951,
  "crystal_system_code": 5,
  "dataset_kind": "external_structure",
  "electronegativity_range": 0.41999999999999993,
  "element_set": [
    "Mo",
    "S",
    "Se",
    "W"
  ],
  "energy_above_hull": null,
  "external_id": "EXT-JVASP-30-TEST",
  "external_source_file": "<ORIGINAL_RUN_ROOT>/POSCAR_JVASP-28634",
  "external_source_format": "poscar",
  "formation_energy": null,
  "formation_energy_peratom": null,
  "formula": "MoW3(SeS3)2",
  "frac_high_coord_sites": 0.0,
  "frac_low_coord_sites": 0.0,
  "frac_short_bonds": 0.0,
  "frac_z_span": 0.65275823406025,
  "ionicity_proxy_comp": 0.41999999999999993,
  "is_centrosymmetric": 0,
  "jid": "EXT-JVASP-30-TEST",
  "known_synthesized": null,
  "material_type": "external",
  "max_axis_over_min_axis": 10.586098894459132,
  "mean_electronegativity": 2.4124999999999996,
  "metal_count": 2,
  "n_elements": 4,
  "n_symmetry_ops": 6,
  "nonmetal_count": 2,
  "reduced_formula": "MoW3(SeS3)2",
  "spacegroup_number": 156,
  "valence_electrons_mean": 11.0,
  "volume_per_atom": 25.62679280819518
}
